"","公司全名","專利號","申請日","獲證日","PR","標題","專利摘要","預測年份","主分支","台灣上市櫃","技術分類","股票代碼","產業別","資料時間","氣動值","月營收成長率","熱度值","營收成長率","毛利成長率","營益成長率","外資成本","投信成本","自營商成本","收盤價","加權後成本"
"268","聯詠科技","TWI778741B","2021-08-11","2022-09-21",94,"觸控顯示裝置及其操作方法","本發明提供一種觸控顯示裝置及其操作方法。觸控顯示裝置包括觸控顯示面板、電源管理電路、顯示驅動電路以及觸控電路。顯示驅動電路驅動觸控顯示面板以顯示影像。顯示驅動電路通知電源管理電路在電壓調整期間中對供應給觸控顯示面板的共同電壓進行電壓調整。觸控電路對觸控顯示面板的觸控感測層的多條感測線個別進行觸控感測操作，以產生這些感測線所對應的多個觸控感測資料。其中，觸控電路忽略電壓調整期間所對應的這些觸控感測資料，或是觸控電路在電壓調整期間中對觸控感測層的這些感測線暫停進行觸控感測操作。","Y2024","main","Yes","其他","3034","半導體","2024-07-26",0.65,-16.31,7,1.59,-0.41,-9.14,495,513.6,560.6,544,515.6
"269","華碩電腦","TWI818356B","2021-11-16","2023-10-11",94,"電子裝置及連接裝置","本案提供一種電子裝置及連接裝置。電子裝置係適於透過一連接裝置與一第二電子裝置電性連接，第二電子裝置包含第二USB C型連接埠及第二電源傳送控制器。在電子裝置中，一第一電源傳送控制器電性連接一第一USB C型連接埠，使第一電源傳送控制器透過第一USB C型連接埠、連接裝置及第二USB C型連接埠與第二電源傳送控制器溝通一傳輸交握資訊。一分析模組電性連接第一電源傳送控制器，以根據傳輸交握資訊判斷電子裝置與第二電子裝置之間可傳輸的至少一功能類型。一提醒裝置電性連接分析模組，用以表示電子裝置與第二電子裝置之間可支援的功能類型。","Y2024","main","Yes","其他","2357","電腦及週邊","2024-07-26",1.13,21.48,1,9.25,82.27,255.33,401.4,389.6,476.8,458,411.8
"270","華邦電子","TWI824292B","2021-09-10","2023-12-01",94,"記憶元件及其製造方法","一種記憶元件，包括：基底；多個字元線，在第一方向延伸，在第二方向排列，位於所述基底上；虛設結構，與所述多個字元線的末端相鄰，位於所述基底上，其中所述虛設結構包括：主體部，在所述第二方向延伸；以及多個延伸部，在所述第一方向延伸，且與所述主體部連接，且介於所述主體部與所述多個字元線之間。","Y2024","main","Yes","記憶體架構","2344","半導體","2024-07-26",0.88,5.56,3,14.88,14.45,83.05,26.1,25.6,23.8,23.45,25.5
"271","華邦電子","TWI824733B","2022-09-22","2023-12-01",94,"半導體結構及其製造方法","一種半導體結構，包括基底與監測標記。基底包括監測區。監測標記位在監測區中。監測標記的上視圖案包括曲線與凹陷。曲線與凹陷彼此相對，曲線具有頂點，且凹陷具有直角轉角。","Y2024","main","Yes","半導體結構","2344","半導體","2024-07-26",0.88,5.56,3,14.88,14.45,83.05,26.1,25.6,23.8,23.45,25.5
"272","訊凱國際","TWI808563B","2021-12-10","2023-07-11",94,"散熱裝置與顯示卡組件","一種散熱裝置包含多片鰭片、至少一第一熱管及至少一第二熱管。些鰭片各包含一鰭片本體及二第一導流片。每一該鰭片本體具有一入風側邊、一出風側邊及二第一連通口。該二第一連通口位於該入風側邊及該出風側邊之間。該二第一導流片分別傾斜設置於該二第一連通口之一側，且自該二第一連通口流出之氣流受該二第一導流片導引而流至該二第一導流片之間。第一熱管位於該二第一導流片之間。第二熱管位於其中一該第一導流片遠離另一該第一導流片之一側。","Y2024","main","No","散熱管理技術",NA,NA,NA,NA,NA,NA,NA,NA,NA,NA,NA,NA,NA,NA
"273","采鈺科技","TWI793858B","2021-11-16","2023-02-21",94,"半導體裝置","提供一種半導體裝置。半導體裝置包含基板，基板具有多個光電轉換元件。半導體裝置也包含第一遮光層，第一遮光層設置於基板之上並具有多個第一孔洞。半導體裝置更包含光調整結構，光調整結構設置於第一遮光層之上。此外，半導體裝置包含第二遮光層，第二遮光層設置於光調整結構之上並具有多個第二孔洞。半導體裝置也包含多個第一聚光結構，第一聚光結構設置於第二遮光層之上並覆蓋第二孔洞。半導體裝置更包含第三遮光層，第三遮光層設置於第一聚光結構之上並具有多個第三孔洞。再者，半導體裝置包含多個第二聚光結構，第二聚光結構覆蓋第三孔洞。半導體裝置也包含第一透光層，第一透光層設置於第二遮光層與第三遮光層之間。每個第一聚光結構的折射率與第一透光層的折射率不同。","Y2024","main","Yes","半導體結構","6789","半導體","2024-07-26",0.2,38.79,10,32.54,11.58,147.96,327,325.1,331.7,316,327.1
"274","采鈺科技","TWI841360B","2023-04-26","2024-05-01",94,"影像感測器與其形成方法","提供一種影像感測器。影像感測器包含基板及隔離結構，隔離結構設置於基板的上方。隔離結構在剖面圖中具有多個隔離區段且不導電，且隔離區段形成界定多個像素區的多個凹槽。影像感測器也包含多個底電極及多個反射層，底電極設置於凹槽的底部，而反射層設置於凹槽的側壁之上。影像感測器更包含光電轉換層及頂電極，光電轉換層設置於隔離結構之上及凹槽內，而頂電極設置於光電轉換層之上。此外，影像感測器包含封裝層，封裝層設置於頂電極之上。","Y2024","main","Yes","虹膜辨識系統","6789","半導體","2024-07-26",0.2,38.79,10,32.54,11.58,147.96,327,325.1,331.7,316,327.1
"275","鼎新電腦","TWI839911B","2022-10-25","2024-04-21",94,"用於調用微服務的系統及方法","提供一種用於調用微服務的系統及方法。所述方法包括：由信任鏈元件模組產生安全權杖；以及在第一微服務模組運行業務邏輯之後，由第一微服務模組利用安全權杖來經由信任鏈元件模組調用第二微服務模組。","Y2024","main","No","其他",NA,NA,NA,NA,NA,NA,NA,NA,NA,NA,NA,NA,NA,NA
"276","世界先進積體電路","TWI817719B","2022-09-15","2023-10-01",93,"半導體結構及其形成方法","提供一種半導體結構。此半導體結構包含基板、磊晶層、井區、閘極電極、導電結構與源極電極。基板具有第一導電型。磊晶層具有第一導電型並設置於基板上。井區具有不同於第一導電型的第二導電型並設置於磊晶層中。閘極電極設置於井區上。導電結構包含上部與下部，其中下部朝向基板方向延伸至磊晶層中，且上部設置於磊晶層上。源極電極設置於導電結構上。","Y2024","main","Yes","半導體結構","5347","半導體","2024-07-26",0.41,30.55,8,17.66,-5.89,-9.69,108.6,100.1,114.7,112.5,106.4
"277","世界先進積體電路","TWI834121B","2022-02-18","2024-03-01",93,"半導體元件及其形成方法","一種半導體元件包括具有第一導電類型的基底、設置於基底上的磊晶層、設置於磊晶層中的摻雜區、以及設置穿過摻雜區並延伸進入磊晶層中的閘極電極。磊晶層具有第一導電類型，而摻雜區具有第二導電類型，第二導電類型不同於第一導電類型。閘極電極包括具有第一尺寸的第一結構和於第一結構之上的第二結構。第二結構包括主體部和於主體部之下的凸出部，其中主體部具有第二尺寸，第二尺寸大於第一尺寸，而凸出部具有第一尺寸。","Y2024","main","Yes","半導體結構","5347","半導體","2024-07-26",0.41,30.55,8,17.66,-5.89,-9.69,108.6,100.1,114.7,112.5,106.4
"278","京元電子","TWI804412B","2022-08-09","2023-06-01",93,"機台對接調整裝置","一種機台對接調整裝置包含有一第一對接模組以及一第二對接模組。第一對接模組包含有一第一基座、一第一定位板安裝於第一基座之上、以及一定位套環組可拆卸地安裝於第一定位板。第二對接模組用以對接該第一對接模組，且包含有一第二基座、一第二定位板安裝於第二基座之上、以及一定位凸柱安裝於第二定位板。第二對接模組的定位凸柱係用來對準第一對接模組的定位套環組。","Y2024","main","Yes","其他","2449","半導體","2024-07-26",0.54,11.24,8,5.8,7.45,7.55,105.5,87.7,116.1,108.5,100.5
"279","創意電子","TWI822280B","2022-08-29","2023-11-11",93,"半導體晶片的介面以及一種具有堆疊式半導體晶片的半導體裝置","一種包括結合件的半導體晶片的介面。介面具有裝置佈局通道以及穿孔佈局通道且半導體晶片包括電路與佈線結構。各裝置佈局通道在第一方向上位於兩穿孔佈局通道之間，以形成在第二方向上延伸的單元佈局通道，第二方向相交於第一方向。結合件排列於依循著穿孔佈局通道的結合件分佈圖中且位於裝置佈局通道之外。在第二方向上最鄰近的兩個結合件以垂直間距間隔排列，第一方向上位於裝置佈局通道的相對兩側的兩個結合件以橫向間距間隔排列，且橫向間距大於垂直間距。部分的電路與佈線結構設置於裝置佈局通道內。本發明也提供一種包括堆疊半導體晶片的半導體裝置。","Y2024","main","Yes","半導體結構","3443","半導體","2024-07-26",0.15,10.3,10,-12.84,-18.95,-36.03,1489,1496.1,1536,1335,1501.2
"280","南亞科技","TWI771138B","2021-08-04","2022-07-11",93,"具有電容器著陸墊之半導體結構的製備方法","本揭露提供一種具有多個電容器著陸墊之半導體結構的製備方法。該製備方法包括下列步驟：提供一半導體基底；形成一位元線結構，其從該半導體基底突伸；沉積一著陸墊層以覆蓋該位元線結構；平坦化該著陸墊層的一上表面；形成一溝槽在該著陸墊層中，以形成多個電容器著陸墊；形成一氣隙在該位元線結構的一側壁內；以及充填一第一介電層在該溝槽中，以密封該氣隙。","Y2024","main","Yes","半導體結構","2408","半導體","2024-07-26",0.82,36.83,9,47.91,50.08,-1.14,68,66.4,66.8,58.1,67.1
"281","南亞科技","TWI779903B","2021-10-26","2022-10-01",93,"具有含錳互連結構的半導體元件結構及其製備方法","本揭露提供一種具有含錳互連結構的半導體元件結構及該半導體元件結構的製備方法。該半導體元件結構具有一第一互連結構，設置在一半導體基底中；一介電層，設置在該半導體結構上；以及一第二互連結構，設置在該介電層中並電性連接到該第一互連結構。該第一互連結構具有一第一導電線以及一第一含錳層，該第一含錳層設置在該第一導電線上。該第二互連結構具有一第二導電線以及一第二含錳層，該第二含錳層設置在該第二導電線與該介電層之間。","Y2024","main","Yes","半導體結構","2408","半導體","2024-07-26",0.82,36.83,9,47.91,50.08,-1.14,68,66.4,66.8,58.1,67.1
"282","南亞科技","TWI809844B","2022-04-27","2023-07-21",93,"半導體結構及半導體製造方法","一種半導體結構包括半導體基材、位於半導體基材的溝槽中的間隔物，其中間隔物包括兩個溝槽氮化物層和夾在兩個溝槽氮化物層之間的空隙。第一氮化物層用以密封兩個溝槽氮化物層之間的空間隙的暴露開口。第二氮化物層在第一氮化物層之上，其中第二氮化物層具有比第一氮化物層高的密度。第三氮化物層具有位於第二氮化物層上方的第一部分和設置在兩個溝槽氮化物層的側壁上的第二部分。","Y2024","main","Yes","半導體結構","2408","半導體","2024-07-26",0.82,36.83,9,47.91,50.08,-1.14,68,66.4,66.8,58.1,67.1
"283","南亞科技","TWI826237B","2023-01-16","2023-12-11",93,"具有固定構件以設置鍵合線的半導體元件","本申請提供一種半導體元件及其製備方法。該半導體元件包括一基板、一電子部件、一鍵合線，以及一固定構件。該電子部件設置於該基板上。該鍵合線包括連接到該電子部件的一第一終端以及連接到該基板的一第二終端。該固定構件設置於該基板上。該鍵合線至少部分地設置於該固定構件上。","Y2024","main","Yes","半導體結構","2408","半導體","2024-07-26",0.82,36.83,9,47.91,50.08,-1.14,68,66.4,66.8,58.1,67.1
"284","南韓商三星電子","TWI795136B","2021-12-22","2023-03-01",93,"半導體存儲裝置","一種半導體記憶體裝置可包括：堆疊，包括交替堆疊於基板上的字元線與層間絕緣圖案，所述字元線在與基板的頂表面平行的第一方向上延伸；半導體圖案，與字元線交叉且具有在與基板的頂表面平行的第二方向上延伸的長軸；資料儲存圖案，分別插置於半導體圖案與字元線之間，所述資料儲存圖案包含鐵電材料；位元線，在與基板的頂表面垂直的第三方向上延伸且在第一方向上彼此間隔開，所述位元線中的每一者與半導體圖案的第一側表面接觸，所述半導體圖案的所述第一側表面在第三方向上彼此間隔開；以及源極線，與半導體圖案的第二側表面接觸。","Y2024","main","No","記憶體架構",NA,NA,NA,NA,NA,NA,NA,NA,NA,NA,NA,NA,NA,NA
"285","南韓商三星電子","TWI824528B","2022-05-20","2023-12-01",93,"具有豎直通道電晶體結構的半導體裝置","一種半導體裝置包括：導電線，在基板上在第一方向上延伸；絕緣圖案層，位於基板上且具有在第二方向上延伸的溝渠，溝渠具有延伸至導電線中的延伸部分；通道層，位於溝渠的相對的側壁上且連接至導電線的藉由溝渠暴露出的區；第一閘極電極及第二閘極電極，位於通道層上且分別沿溝渠的相對的側壁；閘極絕緣層，位於通道層與第一閘極電極及第二閘極電極之間；埋置式絕緣層，在溝渠內位於第一閘極電極與第二閘極電極之間；以及第一接觸件及第二接觸件，分別埋置於絕緣圖案層中且分別連接至通道層的上部區。","Y2024","main","No","半導體結構",NA,NA,NA,NA,NA,NA,NA,NA,NA,NA,NA,NA,NA,NA
"286","南韓商三星電子","TWI843107B","2022-05-24","2024-05-21",93,"發射器電路及其操作方法","本發明提供一種接收並聯信號且回應於並聯信號而輸出串聯信號的發射器電路，所述發射器電路可包含：時脈產生器，產生具有不同各別相位的第一時脈信號；多工器，包含選擇電路，所述選擇電路分別經組態以回應於第一時脈信號中的至少兩者而將並聯信號中的至少兩者選擇性地提供至輸出節點；以及輸出驅動器，藉由放大輸出節點處的信號而產生串聯信號。","Y2024","main","No","其他",NA,NA,NA,NA,NA,NA,NA,NA,NA,NA,NA,NA,NA,NA
"287","台灣積體電路製造","TWI805260B","2022-03-09","2023-06-11",93,"半導體裝置及其製造方法","一種半導體裝置之製造方法，包括：形成由第一半導體材料構成的多個第一層與由第二半導體材料構成的多個第二層交替排列而成的一多層堆疊於一半導體基底上；形成一第一凹槽，穿過多層堆疊；以及橫向凹入多層堆疊的第二層的側壁。上述側壁與第一凹槽相鄰。上述方法更包括：形成具有各自的縫隙的多個內間隔層與多層堆疊的凹入的第二層相鄰；以及對內隔層進行一退火處理，以封閉各自的縫隙。","Y2024","main","Yes","半導體結構","2330","半導體","2024-07-26",0.41,32.9,10,16.52,9.77,7.69,432.2,477.4,895.8,924,543
"288","台灣積體電路製造","TWI805326B","2022-04-14","2023-06-11",93,"半導體裝置和製造半導體裝置的方法","一種製造半導體裝置的方法包括在半導體基板上方沉積多層堆疊，多層堆疊包括與複數個通道層交替的複數個犧牲層；在多層堆疊中形成第一凹陷處；在第一凹陷處中的這些犧牲層的側壁上形成多個第一間隔物；在第一凹陷處中沉積第一半導體材料，其中第一半導體材料是未摻雜的，其中第一半導體材料與第一間隔物中的至少一者的側壁和底表面物理性接觸。在第一半導體材料內佈植摻質，其中在佈植摻質之後，第一半導體材料具有梯度摻雜的分佈；以及在第一半導體材料上方在第一凹陷處中形成外延的源極/汲極區域，其中外延的源極/汲極區域的材料不同於第一半導體材料。","Y2024","main","Yes","半導體結構","2330","半導體","2024-07-26",0.41,32.9,10,16.52,9.77,7.69,432.2,477.4,895.8,924,543
"289","台灣積體電路製造","TWI822280B","2022-08-29","2023-11-11",93,"半導體晶片的介面以及一種具有堆疊式半導體晶片的半導體裝置","一種包括結合件的半導體晶片的介面。介面具有裝置佈局通道以及穿孔佈局通道且半導體晶片包括電路與佈線結構。各裝置佈局通道在第一方向上位於兩穿孔佈局通道之間，以形成在第二方向上延伸的單元佈局通道，第二方向相交於第一方向。結合件排列於依循著穿孔佈局通道的結合件分佈圖中且位於裝置佈局通道之外。在第二方向上最鄰近的兩個結合件以垂直間距間隔排列，第一方向上位於裝置佈局通道的相對兩側的兩個結合件以橫向間距間隔排列，且橫向間距大於垂直間距。部分的電路與佈線結構設置於裝置佈局通道內。本發明也提供一種包括堆疊半導體晶片的半導體裝置。","Y2024","main","Yes","半導體結構","2330","半導體","2024-07-26",0.41,32.9,10,16.52,9.77,7.69,432.2,477.4,895.8,924,543
"290","台灣積體電路製造","TWI825678B","2022-04-14","2023-12-11",93,"用於金屬圖案的鈍化層結構","本文提供了一種半導體元件及其製造方法。前述半導體元件可以包含基板、第一通孔、第一襯墊、第二襯墊以及第一鈍化層。該第一襯墊可以位於該基板上方。該第二襯墊可以位於該基板上方。該第二襯墊可以平行於該第一襯墊。該第一鈍化層可以圍繞該第一襯墊以及該第二襯墊。第一鈍化層可以包含位於該第一襯墊上的第一部分。該第一鈍化層可以包含位於該第二襯墊上的第二部分。該第一鈍化層的該第一部分的厚度可以超過該第一襯墊的高度。該第一鈍化層的該第二部分的厚度可以超過該第二襯墊的高度。","Y2024","main","Yes","半導體結構","2330","半導體","2024-07-26",0.41,32.9,10,16.52,9.77,7.69,432.2,477.4,895.8,924,543
"291","台灣積體電路製造","TWI828309B","2022-09-08","2024-01-01",93,"半導體裝置及其形成方法","一種方法包含在半導體鰭片周圍形成隔離區；在半導體鰭片上方形成閘極結構；在鄰近閘極結構的半導體鰭片中形成源極/汲極區；沉積金屬材料覆蓋隔離區、閘極結構、半導體鰭片和源極/汲極區；在金屬材料中蝕刻出多個開口，其中每個開口暴露出隔離區，其中在蝕刻出開口之後，金屬材料留在源極/汲極區的頂表面；以及沉積絕緣材料，其中絕緣材料填充開口。","Y2024","main","Yes","半導體結構","2330","半導體","2024-07-26",0.41,32.9,10,16.52,9.77,7.69,432.2,477.4,895.8,924,543
"292","台灣積體電路製造","TWI835004B","2021-09-29","2024-03-11",93,"積體電路、積體電路的金屬化結構及其製造方法","一種積體電路(IC)的金屬化結構包含：金屬間介電(IMD)層；圖案化金屬層，嵌入在IMD層中；圖案化頂部金屬層，配置在IMD層上；電通孔，包括穿過IMD層的通孔材料且連接圖案化頂部金屬層和嵌入在IMD層中的圖案化金屬層；以及金屬-絕緣體-金屬(MIM)電容器。MIM電容器包含：第一電容器金屬層，包括接觸嵌入在IMD層中的圖案化金屬層的MIM電容器著陸區域的通孔材料；第二電容器金屬層，包括接觸圖案化頂部金屬層的第一MIM電容器端子區域的通孔材料；以及絕緣體層，配置在第一電容器金屬層與第二電容器金屬層之間。","Y2024","main","Yes","半導體結構","2330","半導體","2024-07-26",0.41,32.9,10,16.52,9.77,7.69,432.2,477.4,895.8,924,543
"293","國立成功大學","TWI835197B","2022-07-11","2024-03-11",93,"製造程序之最佳良率路徑之搜尋方法及其系統","本發明提供一種製造程序之最佳良率路徑之搜尋方法，其利用雙階段機制搜尋出最佳良率路徑。第一階段包含基於演算法來建立搜尋模型；及藉由輸入工件之生產路徑及最終檢查值至搜尋模型中，以選擇出製程站之關鍵製程站，然後依據關鍵製程站產生關鍵路徑。第二階段包含依據生產路徑及最終檢查值建立關鍵路徑之預測模型；及依據預測模型預測對應關鍵路徑之良率，然後依據良率搜尋出關鍵路徑之最佳良率路徑，最佳良率路徑對應此些良率之最佳良率。藉此，既可降低預測路徑數量並涵蓋未走過路徑，亦可考量裝置間的交互作用，以提高路徑搜尋之效。","Y2024","main","No","其他",NA,NA,NA,NA,NA,NA,NA,NA,NA,NA,NA,NA,NA,NA
"294","大陸商北京北方華創微電子裝備","TWI798838B","2021-09-17","2023-04-11",93,"預裝載腔室及半導體製程平臺","一種預裝載腔室及半導體製程平臺，該預裝載腔室包括腔室本體和晶圓支撐架；腔室本體開設有容納腔，晶圓支撐架位於容納腔內，晶圓支撐架沿豎直方向間隔設置的多個用於承載晶圓的承載台和與多個承載台連接的支撐架本體，以及固定件，其中，多個承載台中有至少一者位於支撐架本體的上方，且開設有能夠使固定件穿過的避讓部；固定件用於將支撐架本體與腔室本體固定連接。上述方案能夠解決晶圓的傳輸效率較低的問題。","Y2024","main","No","半導體結構",NA,NA,NA,NA,NA,NA,NA,NA,NA,NA,NA,NA,NA,NA
"295","大陸商北京北方華創微電子裝備","TWI828498B","2022-12-29","2024-01-01",93,"製程腔室組件、半導體製程設備及其方法","一種半導體製程設備的製程腔室組件及半導體製程設備及其方法，該製程腔室組件中，在上腔體和下腔體之間設置有與上腔室連通的第一進氣口和第一排氣口，第一排氣口用於與抽氣裝置連通；在下腔體的底部設置有多個第二排氣口；製程腔室組件還包括勻氣結構和切換結構，勻氣結構位於下腔體的外部，勻氣結構具有勻氣室，勻氣室通過第二排氣口與下腔室連通，在勻氣結構上開設有與勻氣室連通的第三排氣口，第三排氣口用於與抽氣裝置連通；切換結構用於選擇性地將第一排氣口和第三排氣口中的一者與抽氣裝置連通。","Y2024","main","No","半導體結構",NA,NA,NA,NA,NA,NA,NA,NA,NA,NA,NA,NA,NA,NA
"296","大陸商南京瀚宇彩欣科技有限責任公司","TWI831658B","2023-03-27","2024-02-01",93,"書寫顯示裝置","一種書寫顯示裝置被提出，其包括顯示面板與觸控筆。顯示面板包括透光基板和多個第一微結構。透光基板具有基板表面。多個第一微結構設置在基板表面上。觸控筆適於在顯示面板的基板表面上書寫。觸控筆的筆尖表面設有多個第二微結構。多個第一微結構適於伸入多個第二微結構，或多個第二微結構適於伸入多個第一微結構。","Y2024","branch","No","其他",NA,NA,NA,NA,NA,NA,NA,NA,NA,NA,NA,NA,NA,NA
"297","大陸商西安奕斯偉材料科技","TWI834314B","2022-09-27","2024-03-01",93,"一種改善外延片平坦度的矽片基板傳送方法","本發明實施例公開了一種改善外延片平坦度的矽片基板傳送裝置和方法，該傳送裝置佈置在外延沉積設備的反應腔室中，該傳送裝置包括：加熱模組，該加熱模組經配置為在矽片從該反應腔室的外部抵達該反應腔室內的加工位置的過程中，以不同的加熱功率向該矽片輻射熱量；運送模組，該運送模組經配置為在該矽片進入該反應腔室之後，根據該矽片的位置以不同的運動速度將該矽片運送至該加工位置。","Y2024","branch","No","矽片檢測技術",NA,NA,NA,NA,NA,NA,NA,NA,NA,NA,NA,NA,NA,NA
"298","大陸商西安奕斯偉矽片技術","TWI834314B","2022-09-27","2024-03-01",93,"一種改善外延片平坦度的矽片基板傳送方法","本發明實施例公開了一種改善外延片平坦度的矽片基板傳送裝置和方法，該傳送裝置佈置在外延沉積設備的反應腔室中，該傳送裝置包括：加熱模組，該加熱模組經配置為在矽片從該反應腔室的外部抵達該反應腔室內的加工位置的過程中，以不同的加熱功率向該矽片輻射熱量；運送模組，該運送模組經配置為在該矽片進入該反應腔室之後，根據該矽片的位置以不同的運動速度將該矽片運送至該加工位置。","Y2024","branch","No","矽片檢測技術",NA,NA,NA,NA,NA,NA,NA,NA,NA,NA,NA,NA,NA,NA
