"","公司全名","專利號","申請日","獲證日","PR","標題","專利摘要","預測年份","主分支","台灣上市櫃","技術分類","股票代碼","產業別","資料時間","氣動值","月營收成長率","熱度值","營收成長率","毛利成長率","營益成長率","外資成本","投信成本","自營商成本","收盤價","加權後成本"
"179","南韓商三星電子","TWI830406B","2022-09-26","2024-01-21",95,"半導體記憶體裝置","一種半導體記憶體裝置包含：基底，包含單元區及周邊區；單元閘極電極，安置於單元區處；位元線結構，安置於單元區處，且包含單元導電線及安置於單元導電線上的單元線罩蓋膜；鰭狀圖案，安置於周邊區處；周邊閘極電極，與鰭狀圖案交叉；周邊閘極分隔圖案，安置於周邊閘極電極的側壁上且具有高於周邊閘極電極的上表面的上表面；以及周邊層間絕緣膜，覆蓋周邊閘極電極、周邊閘極分隔圖案以及周邊閘極分隔圖案的側壁的一部分。周邊層間絕緣膜的上表面及單元線罩蓋膜的最上表面定位於相對於基底的相同高度處。","Y2024","main","No","記憶體架構",NA,NA,NA,NA,NA,NA,NA,NA,NA,NA,NA,NA,NA,NA
"180","南韓商三星電子","TWI833189B","2022-03-31","2024-02-21",95,"半導體裝置及其製造方法","揭露了半導體裝置及其製造方法。所述半導體裝置包括：基板，包括周邊塊及單元塊，所述單元塊各自包括單元中心區、單元邊緣區以及單元中間區；以及位元線，在每一單元塊上在第一方向上延伸。所述位元線包括中心位元線、中間位元線以及邊緣位元線。所述位元線具有在第二方向上彼此相對的第一側向表面及第二側向表面。第一側向表面在單元中心區、單元中間區及單元邊緣區上沿第一方向直線延伸。第二側向表面在單元中心區及單元邊緣區上沿第一方向直線延伸，並且第二側向表面在單元中間區上沿與第一方向及第二方向相交的第三方向延伸。","Y2024","main","No","半導體結構",NA,NA,NA,NA,NA,NA,NA,NA,NA,NA,NA,NA,NA,NA
"181","友達光電","TWI826130B","2022-11-18","2023-12-11",95,"顯示面板","一種顯示面板包含下部基板、發光二極體晶片與上部基板。下部基板包含介電層、第一電極墊與第二電極墊。第一電極墊位於介電層上。第二電極墊位於介電層上，相鄰第一電極墊，且第一電極墊與第二電極墊用以提供不同電位。發光二極體晶片包含位於相對兩側的第一電極與第二電極，第一電極電性連接第一電極墊。上部基板在下部基板與發光二極體晶片上，上部基板包含載板、上部堤岸結構與透明導電層。載板具有面向下部基板的表面。上部堤岸結構設置在表面。透明導電層覆蓋載板的表面與上部堤岸結構，透明導電層電性連接第二電極與第二電極墊。","Y2024","main","Yes","功率元件","2409","光電業","2024-07-26",0.73,9.86,1,16.19,140.39,55.64,18.2,17.4,18.6,18.05,17.9
"182","台灣積體電路製造","TWI792553B","2021-09-10","2023-02-11",95,"製造半導體元件之方法和系統","對於一種製造半導體元件之方法，對應佈局圖儲存在非暫時性電腦可讀媒體上，此佈局圖係相對於第一及第二垂直方向佈置，此佈局圖包括單元以使得對於單元之子集而言，在子集中之單元中的每一主題者(主題單元)具有鄰域，此鄰域包括相對於第一方向在主題單元之對應第一及第二側上的第一及第二相鄰單元。此方法包括：對於子集中之每一主題單元，產生表示鄰域特定之鄰近效應資訊的副檔案。對於單元之子集中的每一單元，產生副檔案包括以對應於第一相鄰單元所誘導之單元間鄰近效應的第一鄰者特定之鄰近效應(NSPE)參數及對應於第二相鄰單元所誘導之單元間鄰近效應的第二NSPE參數來填充副檔案。","Y2024","main","Yes","半導體結構","2330","半導體","2024-07-26",0.41,32.9,10,16.52,9.77,7.69,432.2,477.4,895.8,924,543
"183","台灣積體電路製造","TWI792908B","2022-02-09","2023-02-11",95,"半導體裝置及其製造方法","本發明實施例揭露具有無襯墊接觸結構的半導體裝置及其製造方法，方法包括於第一和第二鰭結構上形成第一和第二源/汲極區域，於第一和第二源/汲極區域之間形成第一介電層，於第一和第二鰭結構上形成第一和第二全繞式閘極結構，於第一、第二全繞式閘極結構和第一介電層上形成第二介電層，於第二介電層中及第一、第二全繞式閘極結構和第一介電層上形成錐狀溝槽開口，於暴露在錐狀溝槽開口中的第一、第二全繞式閘極結構和第一介電層的頂面上選擇性形成晶種層，於晶種層上選擇性沉積導電層以填充錐狀溝槽開口。","Y2024","main","Yes","半導體結構","2330","半導體","2024-07-26",0.41,32.9,10,16.52,9.77,7.69,432.2,477.4,895.8,924,543
"184","台灣積體電路製造","TWI807705B","2022-03-21","2023-07-01",95,"半導體元件結構及其封裝結構與形成方法","提供了一種半導體元件的結構及形成方法。半導體元件結構包括半導體基板和在半導體基板上的內連線結構。半導體元件結構還包括在內連線結構上的第一導電柱。第一導電柱具有自第一導電柱的較低表面朝向半導體基板延伸的第一凸出部分。半導體元件結構更包括在內連線結構上的第二導電柱。第二導電柱具有自第二導電柱的較低表面上朝向半導體基板延伸的第二凸出部分。第一導電柱相比第二導電柱更靠近半導體基板的中心點。第二凸出部分的底部比第一凸出部分的底部還寬。","Y2024","main","Yes","半導體結構","2330","半導體","2024-07-26",0.41,32.9,10,16.52,9.77,7.69,432.2,477.4,895.8,924,543
"185","台灣積體電路製造","TWI812294B","2022-06-21","2023-08-11",95,"半導體裝置及其製造方法","本揭露實施例提供一種半導體裝置，包括主動區。設置於主動區上方的金屬閘極電極。設置於金屬閘極電極上方的導電層。設置於導電層之第一部分上方的含矽層。設置於導電層之第二部分上方的介電層。垂直地延伸穿過含矽層的閘極通孔。閘極通孔設置於金屬閘極電極上方，並且電性耦接至金屬閘極電極。","Y2024","main","Yes","半導體結構","2330","半導體","2024-07-26",0.41,32.9,10,16.52,9.77,7.69,432.2,477.4,895.8,924,543
"186","台灣積體電路製造","TWI825561B","2022-01-20","2023-12-11",95,"電晶體及其形成方法","在本發明實施例中，形成電晶體的方法可包括：以正向順序或反向順序在基底上形成閘極、半導體金屬氧化物襯層、閘極介電層以及主動層。所述半導體金屬氧化物襯層包含作為氫阻障材料的薄半導體金屬氧化物材料。","Y2024","main","Yes","半導體結構","2330","半導體","2024-07-26",0.41,32.9,10,16.52,9.77,7.69,432.2,477.4,895.8,924,543
"187","台灣積體電路製造","TWI831395B","2022-09-29","2024-02-01",95,"積體電路裝置及其製造方法","一種積體電路裝置包括第一位元線結構，第一位元線結構具有水平部分及垂直部分，其中垂直部分的上表面暴露出來以與接觸件進行電性接觸，接觸件繼而與金屬圖案電性接觸，能夠經由金屬圖案向第一位元線結構施加操作電壓。","Y2024","main","Yes","半導體結構","2330","半導體","2024-07-26",0.41,32.9,10,16.52,9.77,7.69,432.2,477.4,895.8,924,543
"188","台灣積體電路製造","TWI832259B","2022-05-25","2024-02-11",95,"奈米結構電晶體裝置及半導體裝置之形成方法","本揭露的一些實施例提供了一種半導體裝置之形成方法，包括形成一凹槽部於奈米結構電晶體裝置內，用於奈米結構電晶體裝置的一源極/汲極區。上述方法也包括形成一內間隔層於凹槽部的一底部及凹槽部的複數個側壁上。上述方法更包括蝕刻內間隔層，使內間隔層從上述底部及側壁的複數個第一部去除，並使內間隔層餘留於側壁的複數個第二部上。另外，上述方法包括在蝕刻內間隔層後，形成一緩衝層於凹槽部的底部處的奈米結構電晶體裝置的一基底上。上述方法更包括形成一源極/汲極區於凹槽部內的緩衝層上。","Y2024","main","Yes","半導體結構","2330","半導體","2024-07-26",0.41,32.9,10,16.52,9.77,7.69,432.2,477.4,895.8,924,543
"189","台灣積體電路製造","TWI832415B","2022-09-12","2024-02-11",95,"半導體元件及其形成方法","一種半導體元件包含：基材；基材之上的互連結構；互連結構之上的蝕刻停止層；及蝕刻停止層之上的金屬-絕緣體-金屬(MIM)電容器。MIM電容器包含：沿著蝕刻停止層延伸的底部電極，其中底部電極具有層狀結構，其包含第一導體層、第二導體層、及在第一導體層與第二導體層之間的第三導體層，其中第一導體層及第二導體層包含第一材料，第三導體層包含不同於第一材料的第二材料；底部電極之上的第一介電層；中間電極在第一介電層之上，其中中間電極具有層狀結構；中間電極之上的第二介電層；及第二介電層之上的頂部電極。","Y2024","main","Yes","半導體結構","2330","半導體","2024-07-26",0.41,32.9,10,16.52,9.77,7.69,432.2,477.4,895.8,924,543
"190","台灣積體電路製造","TWI834469B","2023-01-09","2024-03-01",95,"半導體封裝及其製造方法","提供一種半導體封裝及其形成方法。所述半導體封裝包括具有第一基底及位於第一基底上的第一接合接墊的第一半導體元件、位於第一基底上且延伸至第一基底中的第一熱傳遞特徵、位於第一基底之上的第二半導體元件、位於第一半導體元件之上且位於第二半導體元件旁的第一熱傳遞橋及位於第一半導體元件之上且沿著第二半導體元件與第一熱傳遞橋的側壁的第一封裝膠體。第二半導體元件包括電性連接至第一接合接墊的第二接合接墊。第一熱傳遞橋包括第二基底及位於第二基底上且延伸至第二基底中的第二熱傳遞特徵。第二熱傳遞特徵接合至第一熱傳遞特徵。","Y2024","main","Yes","半導體結構","2330","半導體","2024-07-26",0.41,32.9,10,16.52,9.77,7.69,432.2,477.4,895.8,924,543
"191","台灣積體電路製造","TWI842343B","2023-01-17","2024-05-11",95,"裝置封裝、半導體封裝及封裝方法","提供一種裝置封裝、半導體封裝和封裝方法。裝置封裝，包括包含第一接合層的第一半導體裝置；接合到第一半導體裝置的第一接合層的第二半導體裝置；設置在第二半導體裝置旁邊及第一接合層上的多個散熱結構，其中散熱結構包括導電材料，其中散熱結構與第一半導體裝置及第二半導體裝置電性絕緣；設置在第一接合層上的封裝膠，其中封裝膠圍繞第二半導體裝置並且圍繞多個散熱結構；以及設置在封裝膠、多個散熱結構和第二半導體裝置上方的第二接合層。","Y2024","main","Yes","半導體結構","2330","半導體","2024-07-26",0.41,32.9,10,16.52,9.77,7.69,432.2,477.4,895.8,924,543
"192","台達電子工業","TWI827286B","2022-09-30","2023-12-21",95,"CAN總線系統及其自動分配節點站號的方法","一種自動分配節點站號的方法，應用於具有主機及通過通訊腳位及模組致能腳位並聯的複數模組的CAN總線系統，包括：由主機設定該模組致能腳位以令複數模組進入分配節點站號模式或一般通訊模式。在分配節點站號模式，由主機通過通訊腳位分配節點站號給擁有通訊權的模組、通知擁有通訊權的模組釋放通訊權，令與此模組串接的下一個模組獲得通訊權；以及在一般通訊模式，令複數模組進行確認節點站號程序。","Y2024","main","Yes","其他","2308","電子零組件","2024-07-26",0.33,0.01,5,-1.68,5.4,-12.04,285.3,314.3,370.6,388,314
"193","新唐科技","TWI818659B","2022-08-04","2023-10-11",95,"微控制器、操作系統及控制方法","一種微控制器，耦接於一主裝置以及一從裝置之間，並包括一第一通訊介面、一串列週邊介面電路、一開關電路、一第二通訊介面以及一切換控制電路。第一通訊介面接收主裝置提供的一第一外部信號。串列週邊介面電路用以產生一內部信號。開關電路根據一控制信號，將一第二外部信號或內部信號作為一輸出信號。第二通訊介面提供輸出信號予從裝置。切換控制電路根據第一外部信號的位準，產生控制信號。","Y2024","main","Yes","無線資料傳輸","4919","半導體","2024-07-26",0.5,-18.01,3,-5.44,-2.13,23.74,125.1,129,123.1,115.5,126.3
"194","日商新唐科技日本","TWI802012B","2021-09-17","2023-05-11",95,"半導體裝置","一種在第1溝延伸存在之第1方向上交互且週期性地設置第1源極區域、及連接第1體區域與第1源極電極之第1連接部的第1縱型場效電晶體，在與第1方向正交之第2方向，相鄰之第1溝與第1溝之間之距離Lxm、及第1溝之內部寬Lxr具有Lxm≤Lxr≤0.20μm之關係，第1連接部之長度是位於即便第1連接部之長度更縮短，往第1閘極導體施加規格值之電壓而使規格值之電流流動時之第1縱型場效電晶體的開電阻亦不會顯著地降低的收斂區。","Y2024","branch","No","其他",NA,NA,NA,NA,NA,NA,NA,NA,NA,NA,NA,NA,NA,NA
"195","日商鎧俠","TWI801099B","2022-01-20","2023-05-01",95,"半導體裝置及其製造方法","本實施形態的半導體裝置是具備基板、第1半導體晶片、第1黏著層、第2半導體晶片、第2黏著層及間隔件。基板是具有第1面。第1半導體晶片是被設在第1面的上方。第1黏著層是被設在與基板對向的第1半導體晶片的下面，含有分子量不同的複數種類的樹脂。第2半導體晶片是被設在基板與第1黏著層之間。第2黏著層是從第1面的法線方向看，被設為覆蓋第2半導體晶片的周圍，含有第1黏著層所含的複數種類的樹脂之中分子量比其他的樹脂更小的至少1種類的樹脂。間隔件是從第1面的法線方向看，被設為覆蓋第2黏著層的周圍。","Y2024","main","No","半導體結構",NA,NA,NA,NA,NA,NA,NA,NA,NA,NA,NA,NA,NA,NA
"196","日商鎧俠","TWI808470B","2021-08-18","2023-07-11",95,"半導體記憶裝置","一種半導體記憶裝置，其包括：在一第一方向上延伸之一第一導電層及第二導電層；及在一第二方向上對準之第一及第二半導體柱列。該等第一半導體柱列各者包括在該第一方向上對準並面向該第一導電層之第一半導體柱。該等第二半導體柱列各者包括在該第一方向上對準並面向該第二導電層之第二半導體柱。例如，假定在該第一方向上該等第一半導體柱中相鄰之兩者之中心位置之間在該第一方向上之一距離係一第一相鄰距離。在此情況下，該等第一半導體柱列在該第二方向上之一間距係該第一相鄰距離之

或更多倍。此外，該等第二半導體柱列在該第二方向上之一間距小於該第一相鄰距離之

倍。","Y2024","main","No","記憶體架構",NA,NA,NA,NA,NA,NA,NA,NA,NA,NA,NA,NA,NA,NA
"197","日商鎧俠","TWI834118B","2022-02-14","2024-03-01",95,"記憶體系統及記憶體系統的控制方法","一個實施方式提供了一種記憶體系統和一種記憶體系統的控制方法，例如，即使在PLP電容器的性能劣化時也可以實現包含PLP功能的記憶體系統。

根據一個實施方式，一種記憶體系統包含控制將資料寫入非揮發性記憶體和揮發性記憶體的控制器，用外部所供應的第一電壓產生多個電壓並將電壓提供給非揮發性記憶體、揮發性記憶體、控制器的電源供應電路和備用電源電路。當該第一電壓與關機命令無關地下降時，該電源供應電路用該備用電源供應電路的輸出電壓來產生該多個電壓。該控制器根據從該備用電源供應電路所饋送的供應能力來改變可儲存在該揮發性記憶體中的資料的大小。","Y2024","main","No","記憶體架構",NA,NA,NA,NA,NA,NA,NA,NA,NA,NA,NA,NA,NA,NA
"198","美商應用材料","TWI803023B","2021-10-21","2023-05-21",95,"用於更高產量和更快轉變時間的半導體處理腔室架構","例示性基板處理系統可包括限定移送區域之腔室主體。系統可包括蓋板，該蓋板沿蓋板之第一表面擱置在腔室主體上。蓋板可限定穿過蓋板之複數個孔隙。蓋板可進一步限定圍繞蓋板之第一表面中的複數個孔隙中之每一孔隙的凹槽。每一凹槽可部分地延伸穿過蓋板之厚度。系統可包括複數個蓋堆疊，其與複數個孔隙之孔隙數目相等。每一凹槽可容納複數個蓋堆疊中之該等蓋堆疊中的一者的至少一部分。複數個蓋堆疊可至少部分地限定垂直偏離移送區域之複數個處理區域。","Y2024","main","No","其他",NA,NA,NA,NA,NA,NA,NA,NA,NA,NA,NA,NA,NA,NA
"199","群創光電","TWI835336B","2022-10-11","2024-03-11",95,"電子裝置及其製造方法","一種電子裝置，包括封裝結構、電路結構、接合結構以及外部元件。電路結構設置於封裝結構上且電性連接至封裝結構。電路結構具有凹陷。接合結構包括第一接合墊與第二接合墊。第二接合墊設置於凹陷內，且第二接合墊設置於第一接合墊上。接合結構設置於電路結構與外部元件之間。外部元件透過接合結構電性連接至電路結構。第一接合墊的寬度小於第二接合墊的寬度。","Y2024","main","Yes","半導體結構","3481","光電業","2024-07-26",1.17,-3.14,1,10.74,166.76,63.17,15,16,15.4,15.55,15.5
"200","聯發科技","TWI836904B","2023-02-16","2024-03-21",95,"半導體封裝結構","一種半導體封裝結構包括封裝基板、半導體裸晶、中介層、粘合層以及成型材料。半導體裸晶被設置在封裝基板的上方。中介層被設置在半導體裸晶的上方。粘合層連接半導體裸晶和中介層。成型材料圍繞半導體裸晶和粘合層。","Y2024","main","Yes","半導體結構","2454","半導體","2024-07-26",0.68,12.75,7,39.53,52.25,123.96,857.2,927.4,1294.5,1245,972.7
"201","英業達","TWI805333B","2022-04-21","2023-06-11",95,"螢幕組件及其旋轉升降支架","一種旋轉升降支架，係用以供一螢幕設置，並包含一底座、一滑塊、一搖桿與一曲柄。底座開設有一沿一第一方向延伸之作動槽。滑塊可移動地設置於該作動槽，並具有一第一滑塊位置與一第二滑塊位置。搖桿樞接滑塊並固定於螢幕。曲柄分別樞接於底座與第二樞接部，並使該樞接端受操作地在一第一行程端點位置與一第二行程端點位置之間沿一弧形路徑移動。其中，在該樞接端位於該第一行程端點位置時，該滑塊係位於該第一滑塊位置，且該螢幕係呈一水平設置狀態；在該樞接端位於該第二行程端點位置時，該滑塊係位於該第二滑塊位置，且該第一樞接部係旋轉驅使該螢幕呈一垂直設置狀態。","Y2024","main","Yes","其他","2356","電腦及週邊","2024-07-26",0.46,6.73,1,8.59,16.19,66.35,54.3,32.9,55.4,49.5,45.9
"202","華邦電子","TWI822143B","2022-06-27","2023-11-11",95,"測試鍵結構及其形成方法","本發明係關於一種測試鍵結構，包含基底、控制閘極、金屬閘極、介電結構、源極線和汲極線。控制閘極設置於基底上方且包含相鄰的第一區域和第二區域。第一區域具有第一導電類型，第二區域具有第二導電類型，並且第一導電類型與第二導電類型不同。金屬閘極設置於控制閘極上方。介電結構埋設於金屬閘極中並將金屬閘極分成第一部分和第二部分，其中介電結構鄰近控制閘極的第一區域和第二區域之間的接面並接觸控制閘極。源極線和汲極線分別設置於控制閘極的兩側。","Y2024","main","Yes","半導體結構","2344","半導體","2024-07-26",0.88,5.56,3,14.88,14.45,83.05,26.1,25.6,23.8,23.45,25.5
"203","財團法人工業技術研究院","TWI817256B","2021-11-19","2023-10-01",95,"透明顯示系統及其控制方法與控制裝置","一種透明顯示系統及其控制方法與控制裝置。透明顯示系統包括資訊擷取組件、透明顯示器及控制裝置。資訊擷取組件用以取得至少一偵測資訊。控制裝置包括偵測單元、資源配置單元及辨識單元。偵測單元用以依據至少一偵測資訊偵測透明顯示器前之至少一使用者及透明顯示器後之至少一目標物件。資源配置單元用以依據至少一偵測資訊之偵測結果，獲得資源配置。資訊擷取組件依據資源配置取得至少一辨識資訊之至少一對內位置資訊。辨識單元辨識出至少一使用者之至少一對內位置資訊及至少一目標物件之至少一對外位置資訊。","Y2024","main","No","其他",NA,NA,NA,NA,NA,NA,NA,NA,NA,NA,NA,NA,NA,NA
"204","采鈺科技","TWI842606B","2023-08-02","2024-05-11",95,"光學裝置","一種光學裝置包含光電轉換層、下伏層、抗反射層以及多個複合單元。下伏層設置於光電轉換層上。抗反射層設置於下伏層上。複合單元設置於光電轉換層上方，其中多個複合單元中的每一者包含頂部與底部，且底部於電轉換層上的投影在頂部於光電轉換層上的投影之內。","Y2024","main","Yes","其他","6789","半導體","2024-07-26",0.2,38.79,10,32.54,11.58,147.96,327,325.1,331.7,316,327.1
"205","韓商韓領","TWI820500B","2021-10-27","2023-11-01",95,"用於提供商店資訊之電子設備的操作方法及支援該操作方法之電子設備","本發明揭示一種電子裝置，其可執行用於基於以下操作提供商店資訊之一操作：獲取來自一使用者之關於一搜尋關鍵字之資訊；當查證關於對應於該搜尋關鍵字之一商店之資訊時，提供關於對應於該搜尋關鍵字之一商店之資訊；及當未查證關於對應於該搜尋關鍵字之該商店之資訊時，藉由查證關於對應於自該搜尋關鍵字擴展之類似關鍵字之商店之資訊來提供關於對應於該類似關鍵字之該商店之資訊。","Y2024","branch","No","其他",NA,NA,NA,NA,NA,NA,NA,NA,NA,NA,NA,NA,NA,NA
"206","世界先進積體電路","TWI805135B","2021-12-17","2023-06-11",94,"轉移晶片的結構和方法以及晶片接合結構","本揭露提供一種轉移晶片的結構，包含氧化層支撐部件、複數個晶片、接合部件、支撐晶圓及間隔部件。氧化層支撐部件具有複數個重複單元，其中各重複單元具有晶片設置區和週邊區，且一個重複單元的晶片設置區分離於相鄰的另一個重複單元的週邊區。複數個晶片設置於氧化層支撐部件的晶片設置區上，接合部件設置於氧化層支撐部件的週邊區上。支撐晶圓設置於氧化層支撐部件下方，且與晶片和接合部件相隔一空隙。間隔部件設置於接合部件和支撐晶圓之間，且間隔部件與接合部件接合。此外，還提供轉移晶片的方法及晶片接合結構。","Y2024","main","Yes","半導體結構","5347","半導體","2024-07-26",0.41,30.55,8,17.66,-5.89,-9.69,108.6,100.1,114.7,112.5,106.4
"207","世界先進積體電路","TWI805524B","2022-11-14","2023-06-11",94,"半導體裝置及其形成方法","提供一種半導體裝置。半導體裝置包含基板、磊晶層、電極結構、第一側壁摻雜區、第二側壁摻雜區與底部摻雜區。基板具有第一導電型。磊晶層具有第一導電型並設置於基板上。電極結構設置於磊晶層中。電極結構沿著一第一方向延伸。第一側壁摻雜區具有第一導電型並設置於電極結構的一側。第二側壁摻雜區具有不同於第一導電型的一第二導電型並設置於電極結構的另一側。底部摻雜區具有第二導電型並設置於電極結構下。第二側壁摻雜區與底部摻雜區連接。","Y2024","main","Yes","半導體結構","5347","半導體","2024-07-26",0.41,30.55,8,17.66,-5.89,-9.69,108.6,100.1,114.7,112.5,106.4
"208","世界先進積體電路","TWI834348B","2022-10-21","2024-03-01",94,"半導體裝置","一種半導體裝置，其包含半導體基底、磊晶層、複數第一金屬結構、複數第一摻雜區、複數第二金屬結構、複數第二摻雜區、導電層及蕭基層。磊晶層設置在半導體基底上。第一金屬結構設置在該磊晶層中，並沿著第一方向延伸，且其在第二方向具有第一寬度。第一摻雜區設置在磊晶層中，其從各第一金屬結構的下部延伸至各第一金屬結構的側壁。第二金屬結構設置在磊晶層中，並沿著第一方向延伸，且其在第二方向具有第二寬度，其中，第一寬度大於第二寬度。導電層設置在半導體基底下，而蕭基層設置在磊晶層上。","Y2024","main","Yes","半導體結構","5347","半導體","2024-07-26",0.41,30.55,8,17.66,-5.89,-9.69,108.6,100.1,114.7,112.5,106.4
