"","公司全名","專利號","申請日","獲證日","PR","標題","專利摘要","預測年份","主分支","台灣上市櫃","技術分類","股票代碼","產業別","資料時間","氣動值","月營收成長率","熱度值","營收成長率","毛利成長率","營益成長率","外資成本","投信成本","自營商成本","收盤價","加權後成本"
"90","國立勤益科技大學","TWI798038B","2022-03-30","2023-04-01",97,"具有手部姿勢操控之人機介面裝置","本發明提供一種具有手部姿勢操控之人機介面裝置，其包含：顯示介面、資料庫、攝影模組及控制模組；顯示介面提供顯示多媒體資訊；資料庫存有複數手部姿勢及對應各手部姿勢之操作指令；攝影模組提供拍攝使用者對應多媒體資訊進行無接觸操控之操作影像；控制模組由攝影模組接收操作影像並透過影像運算處理提取手部影像，由手部影像標記骨架影像，控制模組將骨架影像與資料庫的各手部姿勢進行比對，以獲取匹配之手部姿勢及對應之操作指令，控制模組將獲取之操作指令反饋回應於多媒體資訊，以對多媒體資訊進行無接觸操控，藉此達到無接觸式的操控效果。","Y2024","main","No","其他",NA,NA,NA,NA,NA,NA,NA,NA,NA,NA,NA,NA,NA,NA
"91","大陸商北京北方華創微電子裝備","TWI836483B","2022-06-23","2024-03-21",97,"半導體製程設備及其運動部件的控制方法和裝置","一種半導體製程設備及其運動部件的控制方法和裝置，其中控制方法包括：獲取當前動作任務，該當前動作任務包括多個子動作對象；確定當前子動作對象和待執行子動作對象，該待執行子動作對象被配置為在該當前子動作對象之後執行；控制與該當前子動作對象關聯的當前運動部件執行該當前子動作對象；在執行完該當前子動作對象之後，確定與該待執行子動作對象關聯的待用運動部件；在該待用運動部件不包括該當前運動部件時，將該當前運動部件的運動狀態設置為可用。","Y2024","main","No","半導體結構",NA,NA,NA,NA,NA,NA,NA,NA,NA,NA,NA,NA,NA,NA
"92","宏碁","TWI779863B","2021-10-06","2022-10-01",97,"具散熱和前饋式主動噪音控制功能之電子系統","電子系統包含風扇模組、嵌入式控制器、誤差麥克風、主動降噪控制器，和揚聲器模組。誤差麥克風會在電子系統運作時擷取噪音並輸出相對應誤差訊號。主動降噪控制器依據誤差訊號和嵌入式控制器提供之風扇資訊計算出風扇模組在實際運作時所產生噪音中相關實際單葉片基頻噪音或實際BPF基頻噪音的窄頻帶噪音和相對應的相位差，再依此驅動揚聲器模組以提供反相噪音訊號。透過適應性地調整反向噪音訊號以將誤差訊號之值調至0，以抵銷電子系統運作時所產生噪音，進而同時提供散熱和降噪功能。","Y2024","main","Yes","散熱管理技術","2353","電腦及週邊","2024-07-26",0.73,7.12,1,12.15,15.53,227.42,45.9,38.5,48,45.5,43.4
"93","宏碁","TWI832102B","2021-10-07","2024-02-11",97,"電子裝置的灌封方法","一種電子裝置的灌封方法，包括將電子裝置置入模具，將灌封膠注入模具，待灌封膠固化而與電子裝置成為一體後，以脫模工具插入灌封膠與模具之間以形成開口，將脫模液體從開口持續灌入以分離灌封膠與模具，最後將呈一體的電子裝置與灌封膠從模具內取出。","Y2024","main","Yes","其他","2353","電腦及週邊","2024-07-26",0.73,7.12,1,12.15,15.53,227.42,45.9,38.5,48,45.5,43.4
"94","廣達電腦","TWI832201B","2022-04-08","2024-02-11",97,"電腦執行的方法及計算系統","在此揭露用以產生、配置及使用BIOS組態的系統及方法。效能模式BIOS組態可以為唯一的BIOS設定值的集合，上述集合被建立以優化特定的效能參數或效能參數的集合或組合，例如啟動速度或作業系統安裝速度。根據給定的硬體組態且/或效能參數的集合，一或多個效能模式BIOS組態以一或多個組態負載的形式封包及傳送至BMC記憶體。BIOS設置公用程式或程序顯示在BMC記憶體中所有可使用的組態負載，例如根據效能模式的類型列出 (例如「啟動速度效能模式」及「作業系統安裝效能模式」)，並允許使用者以被選擇的BIOS組態負載覆寫包含目前的BIOS組態的記憶體。","Y2024","main","Yes","其他","2382","電腦及週邊","2024-07-26",0.45,23.44,2,-2.72,24.96,48.86,261.6,186.7,294.1,275,238.2
"95","廣達電腦","TWI840907B","2022-08-05","2024-05-01",97,"偵測偏差的電腦系統及方法，及非暫態電腦可讀取媒體","所揭露的是一種系統及方法，用以鑑別、分析及修復電腦系統之開機自我測試(POST)例行程序中的偏差。電腦系統包含基本輸入輸出系統(BIOS)，BIOS包含於啟動與移交給作業系統之間執行的POST例行程序。記憶體儲存黃金映像檔POST編碼序列。控制器及BIOS從POST例行程序之執行接收一序列POST編碼。該序列POST編碼與黃金映像檔POST編碼序列作比對。基於該序列POST編碼中不符合黃金映像檔POST編碼序列的至少一POST編碼，鑑別出POST例行程序中的偏差。鑑別出的偏差可在訊息中分析進一步資訊。訊息可用以從偏差中復原。","Y2024","main","Yes","其他","2382","電腦及週邊","2024-07-26",0.45,23.44,2,-2.72,24.96,48.86,261.6,186.7,294.1,275,238.2
"96","新唐科技","TWI796912B","2021-12-30","2023-03-21",97,"控制裝置及存取方法","一種控制裝置，耦接一外部記憶體，並包括一記憶單元、一記憶體映射電路以及一中央處理器。記憶單元儲存一韌體映像檔。記憶體映射電路切割韌體映像檔，用以產生複數片段，並將該等片段之每一者的一起始位址與一識別碼進行運算，用以產生一存取順序。中央處理器讀取記憶單元，並依照存取順序，輸出該等片段予外部記憶體。","Y2024","main","Yes","記憶體架構","4919","半導體","2024-07-26",0.5,-18.01,3,-5.44,-2.13,23.74,125.1,129,123.1,115.5,126.3
"97","新唐科技","TWI817343B","2022-01-28","2023-10-01",97,"溝槽閘極式半導體裝置及其形成方法","實施例揭示一種溝槽閘極式半導體裝置，包括具有一溝槽形成於內的一磊晶層。一閘極電極設置於溝槽的一上部，且一遮蔽介電層順沿著溝槽的一下部的一側壁表面及一下表面延伸，且遮蔽介電層的一上表面由閘極電極所覆蓋。一遮蔽電極設置於溝槽的下部且由閘極電極與遮蔽介電層所圍繞，其中一部分的遮蔽電極自遮蔽介電層的上表面突出，且此部分的遮蔽電極的一頂部具有一圓角。一電極間介電層包括一第一部位於閘極電極與遮蔽電極之間，且順應性覆蓋圓角。","Y2024","main","Yes","半導體結構","4919","半導體","2024-07-26",0.5,-18.01,3,-5.44,-2.13,23.74,125.1,129,123.1,115.5,126.3
"98","日商佳能","TWI843295B","2022-11-24","2024-05-21",97,"接合裝置和接合方法","用於將第二物體接合到第一物體的接合裝置包括：第一保持部，其被構造為保持所述第一物體；第二保持部，其被構造為保持所述第二物體；定位機構，其被構造為，就第一方向和第二方向改變所述第一保持部與所述第二保持部之間的相對位置；第一相機，其被構造為拍攝所述第一物體；第二相機，其被構造為拍攝所述第二物體；支撐件，其被構造為支撐所述第二保持部和所述第一相機；以及控制器，其被構造為，基於所述第一相機的輸出和所述第二相機的輸出，就所述第一方向和所述第二方向，控制所述定位機構，使得所述第二物體被定位到所述第一物體的接合目標部分。","Y2024","main","No","其他",NA,NA,NA,NA,NA,NA,NA,NA,NA,NA,NA,NA,NA,NA
"99","日商力森諾科","TWI839042B","2022-12-26","2024-04-11",97,"蝕刻方法","提供一種即使係被認為能壓低側蝕率之低溫蝕刻法，仍不易產生顆粒之蝕刻方法。蝕刻方法具備：將具有蝕刻對象物之被蝕刻構件(4)之溫度作成0℃以下，使含有蝕刻化合物之蝕刻氣體與被蝕刻構件(4)接觸而將蝕刻對象物予以蝕刻的蝕刻步驟，該蝕刻對象物含有矽，該蝕刻化合物為分子內具有氟原子、氫原子、及氧原子之中至少1種原子之化合物。蝕刻氣體含有或不含有具有至少1種金屬之金屬雜質，且在含有金屬雜質時，所含有之全部種類之金屬之濃度總和為4000質量ppb以下。","Y2024","main","No","半導體結構",NA,NA,NA,NA,NA,NA,NA,NA,NA,NA,NA,NA,NA,NA
"100","日商新川","TWI836687B","2022-10-31","2024-03-21",97,"安裝裝置、安裝方法及電腦可讀取記錄媒體","安裝裝置包括：安裝工具；俯視用拍攝單元，用於俯視拍攝基板且採用了沙姆光學系統；仰視用拍攝單元，用於仰視拍攝保持在安裝工具的狀態的安裝體；校準控制部，基於拍攝校準標誌所得的俯視圖像與拍攝相同校準標誌所得的仰視圖像，來運算對基於俯視圖像而算出的座標值與基於仰視圖像而算出的座標值的差量進行校準的校準值；以及安裝控制部，基於由仰視用拍攝單元拍攝保持在安裝工具的安裝體所得的仰視圖像，辨識安裝體的基準位置，並使安裝工具將安裝體載置並安裝於基板，以使所述基準位置與基於由俯視用拍攝單元拍攝基板所得的俯視圖像及校準值而確定的目標位置吻合。","Y2024","main","No","其他",NA,NA,NA,NA,NA,NA,NA,NA,NA,NA,NA,NA,NA,NA
"101","日商日本顯示器","TWI830256B","2022-06-17","2024-01-21",97,"ＬＥＤ晶片之移載方法","本發明提供一種包含修理用之LED晶片之LED晶片形成基板。

LED晶片形成基板包含：第1區域，其包含沿第1方向具有第1節距而配置之複數個第1LED晶片；及第2區域，其位於第1區域之周邊部，包含沿第1方向具有較第1節距大之第2節距而配置之複數個第2LED晶片；且第1LED晶片與第2LED晶片具有同一發光色。又，複數個第2LED晶片之數目為複數個第1LED晶片之數目之0.1%以上10%以下。","Y2024","main","No","其他",NA,NA,NA,NA,NA,NA,NA,NA,NA,NA,NA,NA,NA,NA
"102","日商日立全球先端科技","TWI789900B","2021-09-10","2023-01-11",97,"半導體製造方法及半導體製造裝置","一種半導體製造方法，使用具備處理室(1)的半導體製造裝置(100)，具有：對被載置含有過渡金屬元素的含過渡金屬膜被形成於表面之晶圓(2)的處理室內供給錯合物化氣體，使錯合物化氣體的成分之有機化合物被吸附於含過渡金屬膜之第1步驟，加熱有機化合物吸附於含過渡金屬膜之晶圓，使有機化合物與過渡金屬元素反應變換為有機金屬錯合物，使有機金屬錯合物脫離之第2步驟；有機化合物具有路易斯鹼基性，是可與過渡金屬元素形成2處以上的配位結合之多配位基分子。","Y2024","main","No","半導體結構",NA,NA,NA,NA,NA,NA,NA,NA,NA,NA,NA,NA,NA,NA
"103","日商鎧俠","TWI786780B","2021-08-20","2022-12-11",97,"半導體裝置及半導體記憶裝置","實施方式提供一種耐熱性高之半導體裝置及半導體記憶裝置。  實施方式之半導體裝置具備：氧化物半導體層，其包含第1部分、第2部分、及第1部分與第2部分之間之第3部分；閘極電極；第3部分與閘極電極之間之閘極絕緣層；第1電極，其電性連接於第1部分，且包含第1區域、第2區域、第3區域、及第4區域，第1區域位於第1部分與第2區域之間，第1區域位於第3區域與第4區域之間，第1區域包含選自由In、Zn、Sn、及Cd所組成之群中之至少一種元素及氧，第2區域包含選自由Ti、Ta、W、及Ru所組成之群中之至少一種金屬元素，第3區域及第4區域包含至少一種金屬元素及O，第3區域及第4區域之氧原子濃度高於第2區域；及第2電極，其電性連接於第2部分。","Y2024","main","No","半導體結構",NA,NA,NA,NA,NA,NA,NA,NA,NA,NA,NA,NA,NA,NA
"104","日商鎧俠","TWI808832B","2022-07-15","2023-07-11",97,"半導體裝置","本發明提供一種改善了標準單元之單元圖案之面積效率的半導體裝置。

實施方式之半導體裝置具備：第1電源線及第2電源線，其等在第1方向上延伸，且彼此相離地配置；第3電源線，其在與上述第1方向正交之第2方向上與上述第1電源線平行且相鄰地配置，且電位與上述第2電源線相同；第4電源線，其在上述第2方向之負方向上與上述第2電源線平行且相鄰地配置，且電位與上述第1電源線相同；第1電晶體，其配置在上述第1電源線之下方，具有在上述第2方向及上述第2方向之負方向上延伸之第1導電型之第1活性區域；第2電晶體，其配置在上述第2電源線之下方，具有在上述第2方向及上述第2方向之負方向上延伸之第2導電型之第2活性區域；第3電晶體，其配置在上述第1活性區域與上述第3電源線之間，且具有第2導電型之第3活性區域；及第4電晶體，其配置在上述第2活性區域與上述第4電源線之間，且具有第1導電型之第4活性區域。","Y2024","main","No","半導體結構",NA,NA,NA,NA,NA,NA,NA,NA,NA,NA,NA,NA,NA,NA
"105","日商鎧俠","TWI818630B","2022-07-19","2023-10-11",97,"半導體裝置","提供一種可抑制訊號品質的下降的半導體裝置。本實施方式的半導體裝置包括：基板，具有第一面、以及設置於所述第一面上的第一焊墊及第二焊墊；晶片積層體，由具有與所述第一面相向的第二面、所述第二面的相反側的第三面、以及設置於所述第三面上的第三焊墊及第四焊墊的多個第一半導體晶片積層而成；第一導線組，包含將所述第一焊墊與所述第一半導體晶片各自的所述第三焊墊電性連接的多個第一導線；第二導線，將所述第二焊墊與多個所述第一半導體晶片中最靠近所述基板的所述第一半導體晶片的所述第四焊墊電性連接；以及第三導線，將多個所述第一半導體晶片各自的所述第四焊墊電性連接。","Y2024","main","No","半導體結構",NA,NA,NA,NA,NA,NA,NA,NA,NA,NA,NA,NA,NA,NA
"106","日商鎧俠","TWI828133B","2022-05-02","2024-01-01",97,"半導體記憶裝置","提供一種達成了讀出動作之高速化的半導體記憶裝置。        其中一個實施形態之半導體記憶裝置，係具有複數之第1記憶體胞電晶體(MT0~MT7)、和第1選擇電晶體(ST1)、和第2選擇電晶體(ST2)、和複數之第2記憶體胞電晶體(MT0~MT7)、和第3選擇電晶體(ST3)、和第4選擇電晶體(ST4)、和被與前述複數之第1記憶體胞電晶體(MT0~MT7)共通地作驅動之複數之第3記憶體胞電晶體(MT8~MT15)、和第5選擇電晶體(ST5)、和第6選擇電晶體(ST6)、和被與前述複數之第2記憶體胞電晶體(MT0~MT7)共通地作驅動之複數之第4記憶體胞電晶體(MT8~MT15)、和第7選擇電晶體(ST7)、以及第8選擇電晶體(ST8)。","Y2024","main","No","記憶體架構",NA,NA,NA,NA,NA,NA,NA,NA,NA,NA,NA,NA,NA,NA
"107","日商鎧俠","TWI837750B","2022-08-01","2024-04-01",97,"半導體裝置、基板及半導體裝置之製造方法","本發明提供一種可更適當地將晶片連接於基板之半導體裝置、基板及半導體裝置之製造方法。        本實施形態之半導體裝置具備：基板，其具有：第1面；與上述第1面為相反側之第2面；複數個導電連接部，其等設置於上述第1面上；及複數個柱狀電極，其等以自複數個上述導電連接部之各者朝向上述第2面延伸之方式設置，具有錐形狀；以及半導體晶片，其具有：第3面，其與上述第1面對向；及複數個連接凸塊，其等設置於上述第3面上，與複數個上述導電連接部之各者電性連接；且配置於上述半導體晶片所配置之上述第1面上之晶片區域中之第1區域之上述柱狀電極，具有與配置於上述晶片區域中之第2區域之上述柱狀電極反向之錐形狀。","Y2024","main","No","半導體結構",NA,NA,NA,NA,NA,NA,NA,NA,NA,NA,NA,NA,NA,NA
"108","旺宏電子","TWI787080B","2022-02-10","2022-12-11",97,"三維快閃記憶體元件","一種記憶體元件，包括：基底、多個第一記憶體陣列、多個第一位元線、第一共同源極板以及第一陣列穿孔接觸窗。多個第一記憶體陣列位於所述基底的第一平面區中。多個第一位元線，位於所述多個第一記憶體陣列與所述基底之間，且與所述多個第一記憶體陣列電性連接。第一共同源極板位於所述多個第一記憶體陣列上方，且與所述多個第一記憶體陣列電性連接。第一陣列穿孔接觸窗設置於所述第一平面區外的第一接觸區，電性連接所述第一共同源極板。","Y2024","main","Yes","記憶體架構","2337","半導體","2024-07-26",0.66,1.77,4,-18.91,-36.03,-196.47,27.3,28.8,27.3,25.7,27.9
"109","美商應用材料","TWI816324B","2022-03-10","2023-09-21",97,"用於製造微型ＬＥＤ顯示器的系統及方法","一種用於製造發光二極體(LED)顯示器的工具及方法。工具包括用於將第一顏色轉換前驅物遞送到工件上的第一分配腔室。第一固化站固化工件以在工件上的LED的第一集合上方形成第一顏色轉換層。第一洗滌/乾燥腔室從工件移除第一顏色轉換前驅物的未固化部分並且隨後乾燥工件。第二分配腔室將第二顏色轉換前驅物遞送到工件上。第二固化站固化第二顏色轉換前驅物以在工件上的LED的第二集合上方形成第二顏色轉換層。第二洗滌/乾燥腔室從工件移除第二顏色轉換層的未固化部分。腔室的每一者係獨立可密封的。控制器控制工件運輸系統以在腔室之間順序地移動工件。","Y2024","main","No","其他",NA,NA,NA,NA,NA,NA,NA,NA,NA,NA,NA,NA,NA,NA
"110","群創光電","TWI832262B","2022-05-26","2024-02-11",97,"允許光線穿過的電子裝置及其構成的電子模組","本揭露公開了一種允許一光線穿過的電子裝置及包括所述電子裝置之一電子模組。所述電子裝置包括一基板，一含矽半導體設置在所述基板上，一第一導電層設置在所述含矽半導體上，一氧化物半導體設置在所述基板上，以及一第二導電層設置在所述氧化物半導體上。所述第一導電層以及所述第二導電層的其中一者包括允許所述光線穿過的一第一開口。所述電子模組包括所述電子裝置以及設置在所述電子裝置下方的一指紋感測器或一影像感測器。","Y2024","main","Yes","其他","3481","光電業","2024-07-26",1.17,-3.14,1,10.74,166.76,63.17,15,16,15.4,15.55,15.5
"111","聯發科技","TWI809860B","2022-05-09","2023-07-21",97,"執行主機控制器對儲存設備的中止處理的方法與系統","主機系統啟動中止已置於主機系統的提交隊列(SQ)中的命令。主機系統識別第一結果和第二結果中的至少一個。當第一結果表示命令未完成，第二結果表示已從SQ獲取SQ條目時，主機系統向儲存設備發送中止請求，並發出清理請求以指示主機控制器回收分配給命令的主機硬體資源。主機系統將完成隊列(CQ)條目添加到CQ，並基於第一結果和第二結果中的至少一個來設置CQ條目的總體命令狀態(OCS)值。","Y2024","main","Yes","其他","2454","半導體","2024-07-26",0.68,12.75,7,39.53,52.25,123.96,857.2,927.4,1294.5,1245,972.7
"112","致伸科技","TWI796150B","2022-03-01","2023-03-11",97,"發光滾輪結構","本發明提供一種發光滾輪結構，包括滾輪、支撐架以及光源模組。支撐架用以支撐滾輪並包括彼此相對的第一支撐部與第二支撐部，滾輪位於第一支撐部與第二支撐部之間。第一支撐部具有至少一貫穿開孔。貫穿開孔包括第一側壁段與第二側壁段，第二側壁段位於第一側壁段與滾輪之間，第一側壁段定義出第一開口，第二側壁段朝靠近滾輪的方向逐漸傾斜而定義出與第一開口相對的第二開口，第二開口的口徑大於第一開口的口徑。光源模組包括一電路板以及配置於電路板上的至少一發光元件。電路板配置於第一支撐部，使得發光元件對應於貫穿開孔。","Y2024","main","Yes","其他","4915","電子零組件","2024-07-26",0.72,-4.71,1,-7.01,-0.72,2.74,83.7,74.9,91.2,91,81.7
"113","英業達","TWI772189B","2021-09-24","2022-07-21",97,"硬碟模擬裝置及應用該裝置的測試系統及其測試方法","一種硬碟模擬裝置及應用該裝置的測試系統及其測試方法，透過提供具有檢測電路的硬碟模擬裝置以連接待測裝置，並且串接硬碟模擬裝置及待測裝置的測試連接埠，以便在待測裝置執行測試程序時，讀取待測裝置的插槽的信號連接狀態，以及通過測試連接埠傳送檢測指令驅動硬碟模擬裝置的檢測電路檢測電源腳位、時脈腳位及系統管理匯流排的信號以產生檢測結果，進而根據信號連接狀態及檢測結果驗證待測裝置的正確性，用以達到降低待測裝置的測試成本之技術功效。","Y2024","main","Yes","其他","2356","電腦及週邊","2024-07-26",0.46,6.73,1,8.59,16.19,66.35,54.3,32.9,55.4,49.5,45.9
"114","中興保全科技","TWI805334B","2022-04-22","2023-06-11",96,"網路監控錄像的異常偵測系統、方法與雲端伺服器","一種網路監控錄像的異常偵測系統、方法與雲端伺服器，其係包括本地端伺服器、雲端伺服器與監控錄像設備。本地端伺服器提供遠端儲存路徑資訊；監控錄像設備網路連接於本地端伺服器與雲端伺服器；監控錄像設備根據遠端儲存路徑資訊將串流影像資訊發送至雲端伺服器；雲端伺服器將串流影像資訊錄製為錄影檔案；雲端伺服器根據檔案錄製選項計數監控錄像設備的錄影檔案的錄影檔案數量；當錄影檔案數量大於警戒上限門檻值，雲端伺服器輸出警示訊息。","Y2024","main","Yes","其他","9917","其他","2024-07-26",0.48,-0.25,7,5.29,3.91,2.85,74.3,114.5,126.5,134,100.8
"115","中華電信","TWI805438B","2022-07-08","2023-06-11",96,"電子文件的存取權限的管理系統和管理方法","提出一種電子文件的存取權限的管理系統和管理方法。方法包含：由雲端伺服器儲存第一刪減文件的雜湊值、機密資料的密文、對應於機密資料的權限等級以及對應於機密資料的索引，第一刪減文件包含對應於索引的刪減區域；由第一終端裝置儲存第一刪減文件，並且自雲端伺服器接收雜湊值、密文、權限等級以及索引；由第一終端裝置響應於雜湊值與第一刪減文件匹配而根據索引、權限等級和密文還原第一刪減文件的刪減區域，從而產生第二刪減文件；以及由第一終端裝置傳送第二刪減文件至雲端伺服器。","Y2024","main","Yes","其他","2412","通信網路業","2024-07-26",0.62,-2.93,8,1.35,-0.45,-2.05,109.5,117.1,119.1,122.5,114.5
"116","力晶積成電子製造","TWI812356B","2022-07-18","2023-08-11",96,"半導體加工的方法及製具","半導體加工的方法包括以下步驟：提供半導體基板；形成膠層於半導體基板的表面上，其中膠層包括第一區及第二區，且第二區較第一區接近半導體基板的邊緣；以及使光束藉由製具以於對位於半導體基板的表面上的膠層的第二區進行半固化，其中從製具射向膠層的光束的主射線方向基本上平行於半導體基板的表面。","Y2024","main","Yes","半導體結構","6770","半導體","2024-07-26",0.9,8.49,5,-5.5,-22.26,-420.62,25.8,30.5,26.1,23.15,27.7
"117","力晶積成電子製造","TWI822621B","2023-03-30","2023-11-11",96,"檢測裝置","一種檢測裝置，包括：一基底、一感測裝置、以及一處理裝置。感測裝置，位於所述基底上方，用以產生多個狀態訊號，所述多個狀態訊號包括第一狀態訊號及第二狀態訊號。所述感測裝置包括：一感測器層、以及一導電膜。感測器層，位於所述基底上方，包括一第一感測器與一第二感測器。所述第一感測器用以產生所述第一狀態訊號，所述第二感測器用以產生所述第二狀態訊號。導電膜，具有一底面，位於所述感測器層上方。所述導電膜的所述底面與所述第一感測器的頂面與所述第二感測器的頂面具有一第一距離。所述導電膜具有一第一電位。處理裝置，位於所述感測裝置上方，與所述感測裝置電性耦合，用以接收並處理所述多個狀態訊號。當所述導電膜未接觸所述第一感測器時，所述第一狀態訊號為零電位，當所述導電膜接觸所述第一感測器時，所述第一狀態訊號為所述第一電位，當所述導電膜未接觸所述第二感測器時，所述第二狀態訊號為零電位，當所述導電膜接觸所述第二感測器時，所述第二狀態訊號為所述第一電位。","Y2024","main","Yes","半導體結構","6770","半導體","2024-07-26",0.9,8.49,5,-5.5,-22.26,-420.62,25.8,30.5,26.1,23.15,27.7
